{
  "schema_version": "benchmark_catalog.v1",
  "generated_at": "2026-06-29",
  "principles": [
    "Benchmark data is user-managed and imported from local files under HARNESS_DATA_DIR/benchmarks.",
    "Tablex never stores Kaggle credentials, API tokens, connector secrets, or production write credentials.",
    "The v0 importer profiles one primary table as a DatasetSnapshot and stores a manifest for supporting tables."
  ],
  "datasets": [
    {
      "id": "kaggle_home_credit_default_risk",
      "name": "Home Credit Default Risk",
      "source_kind": "kaggle_competition",
      "source_url": "https://www.kaggle.com/competitions/home-credit-default-risk",
      "access": {
        "kind": "credentialed_competition",
        "requires_account": true,
        "requires_secret": true,
        "supports_direct_download": false
      },
      "source_card": {
        "verified_at": "2026-06-29",
        "official_sources": [
          {
            "title": "Kaggle Home Credit Default Risk competition",
            "url": "https://www.kaggle.com/competitions/home-credit-default-risk",
            "source_type": "competition_page"
          }
        ]
      },
      "competition_slug": "home-credit-default-risk",
      "license_note": "Kaggle competition terms apply. Download with a user-managed Kaggle account outside Tablex.",
      "task_types": ["binary_classification"],
      "modality_tags": ["multi_table", "credit_risk", "tabular", "imbalanced_classification"],
      "scale": "medium",
      "recommended_uses": [
        "multi-table feature recipe development",
        "credit-risk leakage and prediction-time availability checks",
        "evaluation sanity checks for imbalanced binary classification",
        "agent task contracts that need joins, aggregation, and reportable assumptions"
      ],
      "scenario": {
        "kind": "multi_table_credit_risk",
        "validation_focus": "stratified_with_entity_and_time_leakage_review",
        "feature_focus": ["relational_aggregations", "credit_history_summaries", "prediction_time_availability", "leakage_controls"],
        "report_focus": ["relationship_coverage", "assumption_risk", "feature_scenario_comparison", "calibration_or_threshold_summary", "leaderboard"]
      },
      "primary_table": {
        "path": "application_train.csv",
        "target_column": "TARGET",
        "entity_id_column": "SK_ID_CURR",
        "description": "Main labeled application table used for v0 profiling and baseline setup."
      },
      "required_files": [
        {
          "path": "application_train.csv",
          "role": "primary_table",
          "description": "Labeled application rows."
        }
      ],
      "recommended_files": [
        { "path": "bureau.csv", "role": "supporting_table", "description": "Previous credits reported to credit bureau." },
        { "path": "bureau_balance.csv", "role": "supporting_table", "description": "Monthly bureau credit status history." },
        { "path": "previous_application.csv", "role": "supporting_table", "description": "Previous Home Credit applications." },
        { "path": "POS_CASH_balance.csv", "role": "supporting_table", "description": "POS and cash loan monthly balance history." },
        { "path": "credit_card_balance.csv", "role": "supporting_table", "description": "Credit card balance history." },
        { "path": "installments_payments.csv", "role": "supporting_table", "description": "Repayment history." },
        { "path": "application_test.csv", "role": "holdout_table", "description": "Kaggle test rows without labels." }
      ],
      "download": {
        "method": "kaggle_cli",
        "requires_account": true,
        "command": "kaggle competitions download -c home-credit-default-risk -p data/benchmarks/kaggle_home_credit_default_risk --unzip"
      },
      "evaluation_notes": "Use application_train.csv for local labeled evaluation. Avoid leaking application_test.csv into feature engineering. Prefer stratified or group-aware validation once row/entity semantics are confirmed.",
      "risk_notes": [
        "Credit outcomes are time-sensitive; random splits can overstate production performance.",
        "Supporting tables may contain post-application information unless prediction-time availability is verified."
      ]
    },
    {
      "id": "kaggle_home_credit_model_stability",
      "name": "Home Credit Credit Risk Model Stability",
      "source_kind": "kaggle_competition",
      "source_url": "https://www.kaggle.com/competitions/home-credit-credit-risk-model-stability",
      "competition_slug": "home-credit-credit-risk-model-stability",
      "license_note": "Kaggle competition terms apply. Download with a user-managed Kaggle account outside Tablex.",
      "task_types": ["binary_classification", "model_stability"],
      "modality_tags": ["multi_table", "credit_risk", "temporal_stability", "parquet"],
      "scale": "large",
      "recommended_uses": [
        "multi-table parquet ingestion stress tests",
        "temporal stability and drift-sensitive evaluation design",
        "agent planning for feature recipe selection under many relational tables"
      ],
      "primary_table": {
        "path_candidates": [
          "parquet_files/train/train_base.parquet",
          "csv_files/train/train_base.csv",
          "train_base.parquet",
          "train_base.csv"
        ],
        "target_column": "target",
        "entity_id_column": "case_id",
        "time_column": "date_decision",
        "description": "Base train table. The competition also supplies many depth-0/1/2 relational feature tables."
      },
      "required_files": [
        {
          "path_candidates": [
            "parquet_files/train/train_base.parquet",
            "csv_files/train/train_base.csv",
            "train_base.parquet",
            "train_base.csv"
          ],
          "role": "primary_table",
          "description": "Base labeled training table."
        }
      ],
      "recommended_files": [
        { "glob": "parquet_files/train/*.parquet", "role": "supporting_table", "description": "Parquet train tables for relational features." },
        { "glob": "parquet_files/train/*/*.parquet", "role": "supporting_table", "description": "Nested parquet train tables when extracted with directory structure." },
        { "glob": "csv_files/train/*.csv", "role": "supporting_table", "description": "CSV train tables when using the CSV archive." }
      ],
      "download": {
        "method": "kaggle_cli",
        "requires_account": true,
        "command": "kaggle competitions download -c home-credit-credit-risk-model-stability -p data/benchmarks/kaggle_home_credit_model_stability --unzip"
      },
      "evaluation_notes": "Prefer time-aware stability evaluation when date_decision is available. The v0 importer only profiles the base table; relational feature generation should be an AgentTask with a manifest of supporting tables.",
      "risk_notes": [
        "Dataset scale can exceed local memory if all supporting files are eagerly copied.",
        "Stability metrics need explicit validation windows rather than a single random split."
      ]
    },
    {
      "id": "kaggle_ieee_cis_fraud_detection",
      "name": "IEEE-CIS Fraud Detection",
      "source_kind": "kaggle_competition",
      "source_url": "https://www.kaggle.com/competitions/ieee-fraud-detection",
      "competition_slug": "ieee-fraud-detection",
      "license_note": "Kaggle competition terms apply. Download with a user-managed Kaggle account outside Tablex.",
      "task_types": ["binary_classification"],
      "modality_tags": ["fraud", "multi_table", "imbalanced_classification", "identity_features"],
      "scale": "medium",
      "recommended_uses": [
        "fraud benchmark with severe class imbalance",
        "join handling between transaction and identity tables",
        "leakage checks around transaction time and identity availability"
      ],
      "primary_table": {
        "path": "train_transaction.csv",
        "target_column": "isFraud",
        "entity_id_column": "TransactionID",
        "time_column": "TransactionDT",
        "description": "Main transaction table with target."
      },
      "required_files": [
        { "path": "train_transaction.csv", "role": "primary_table", "description": "Labeled transaction rows." }
      ],
      "recommended_files": [
        { "path": "train_identity.csv", "role": "supporting_table", "description": "Identity features joined by TransactionID." },
        { "path": "test_transaction.csv", "role": "holdout_table", "description": "Kaggle test transactions." },
        { "path": "test_identity.csv", "role": "holdout_table", "description": "Kaggle test identity rows." }
      ],
      "download": {
        "method": "kaggle_cli",
        "requires_account": true,
        "command": "kaggle competitions download -c ieee-fraud-detection -p data/benchmarks/kaggle_ieee_cis_fraud_detection --unzip"
      },
      "evaluation_notes": "Use stratified validation at minimum. Time-based validation with TransactionDT is more realistic if the task is framed as forward fraud detection.",
      "risk_notes": [
        "Identity fields are sparse and may be unavailable for all transactions.",
        "Class imbalance makes accuracy and uncalibrated threshold metrics misleading."
      ]
    },
    {
      "id": "kaggle_store_sales_forecasting",
      "name": "Store Sales - Time Series Forecasting",
      "source_kind": "kaggle_competition",
      "source_url": "https://www.kaggle.com/competitions/store-sales-time-series-forecasting",
      "competition_slug": "store-sales-time-series-forecasting",
      "license_note": "Kaggle competition terms apply. Download with a user-managed Kaggle account outside Tablex.",
      "task_types": ["forecasting", "regression"],
      "modality_tags": ["time_series", "retail", "multi_table", "hierarchical"],
      "scale": "medium",